A2: 2008 PA Grand Prix Standings
F3: updated | G3: 39740
A4: Teams
C5: DATE: | D5: 39501 | E5: 39593 | F5: 39676 | G5: 39698 | H5: 39740
C6: Location: | D6: Los Gatos | E6: San Mateo | F6: Reno | G6: Oakland | H6: Sacramento
A7: PLACE | B7: Club/Distance | D7: 1 Hour | E7: 5K | F7: 3K | G7: 20K | H7: 10K | I7: Total
A8: =RANK(I8,$I$8:$I$14) -> 1 | B8: Sierra Racewalkers | D8: 10 | E8: 8 | F8: 8 | H8: 10 | I8: =D8+E8+F8+H8 -> 36
A9: =RANK(I9,$I$8:$I$14) -> 2 | B9: Marin Racewalkers | E9: 10 | F9: 10 | I9: =D9+E9+F9 -> 20
A10: =RANK(I10,$I$8:$I$14) -> 3 | B10: Pacific Racewalk Organization | F10: 7 | H10: 8 | I10: =D10+E10+F10+H10 -> 15
A11: =RANK(I11,$I$8:$I$14) -> 4 | B11: Golden Gate Racewalkers | E11: 7 | I11: =D11+E11+F11 -> 7
B12: Santa Cruz Track Club
B13: Monterey Pennisula WWW Club
A15: NOTES: See Race Walking Rules for details. For teams, 1st place = 10 points; 2nd = 8 points; 3rd = 7 points; etc.; 9th place and lower =1.
A16: No team had three race walkers in the 20K on September 7. Total = best 4 out of 5 races.
A18: Age Graded Individuals (includes women and men together)
B19: DATE | D19: 39501 | E19: 39593 | F19: 39676 | G19: =G5 -> 39698 | H19: =H5 -> 39740
B20: Location | D20: Los Gatos | E20: San Mateo | F20: Reno | G20: Oakland | H20: =H6 -> Sacramento
A21: PLACE | B21: Walker (age during season) | C21: Club | D21: 1 Hour | E21: 5K | F21: 3K | G21: 20K | H21: =H7 -> 10K | I21: Total
A23: =RANK(I23,$I$23:$I$57) -> 1 | B23: Louise Walters, 68 | C23: SRW | E23: 9 | F23: 9 | G23: 10 | H23: 10 | I23: =D23+E23+F23+G23+H23 -> 38
A24: =RANK(I24,$I$23:$I$57) -> 2 | B24: Tyler Sorensen, 14 | C24: Pleasanton Heat | D24: 10 | E24: 8 | H24: 5 | I24: =D24+E24+F24+G24+H24 -> 23
A25: =RANK(I25,$I$23:$I$57) -> 3 | B25: Karen Stoyanowski, 53 | C25: SRW | D25: 8 | E25: 1 | F25: 4 | H25: 8 | I25: =D25+E25+F25+G25+H25 -> 21
A26: =RANK(I26,$I$23:$I$57) -> 4 | B26: Jack Bray, 75 | C26: MRW | E26: 10 | F26: 10 | I26: =D26+E26+F26+G26+H26 -> 20
A27: =RANK(I27,$I$23:$I$57) -> 5 | B27: Kelly Wong, 32 | C27: GGRW | D27: 5 | E27: 6 | F27: 1 | G27: 7 | I27: =D27+E27+F27+G27+H27 -> 19
A28: =RANK(I28,$I$23:$I$57) -> 5 | B28: Joseph Berendt, 52 & 53 | C28: SRW | D28: 6 | E28: 1 | F28: 1 | G28: 8 | H28: 3 | I28: =D28+E28+F28+G28+H28 -> 19
A29: =RANK(I29,$I$23:$I$57) -> 7 | B29: Nicolette Sorensen, 12 | C29: Pleasanton Heat | E29: 7 | H29: 9 | I29: =D29+E29+F29+G29+H29 -> 16
A30: =RANK(I30,$I$23:$I$57) -> 8 | B30: Kevin Killingsworth, 52 | C30: MRW | D30: 7 | E30: 5 | I30: =D30+E30+F30+G30+H30 -> 12
A31: =RANK(I31,$I$23:$I$57) -> 9 | B31: Susan Armenta, 34 | C31: Wolfpack Intl | D31: 9 | I31: =D31+E31+F31+G31+H31 -> 9
A32: =RANK(I32,$I$23:$I$57) -> 9 | B32: M. J. Baglin, 61 | C32: PRO | G32: 9 | I32: =D32+E32+F32+G32+H32 -> 9
A33: =RANK(I33,$I$23:$I$57) -> 11 | B33: Abderrezak Gharfara, 38 | C33: MRW | E33: 2 | F33: 6 | I33: =D33+E33+F33+G33+H33 -> 8
A34: =RANK(I34,$I$23:$I$57) -> 11 | B34: Ted Moore, 69 | C34: PRO | F34: 8 | I34: =D34+E34+F34+G34+H34 -> 8
A35: =RANK(I35,$I$23:$I$57) -> 11 | B35: Ronald Walters, 69 & 70 | C35: SRW | E35: 1 | H35: 7 | I35: =D35+E35+F35+G35+H35 -> 8
A36: =RANK(I36,$I$23:$I$57) -> 14 | B36: James Beckett, 69 | C36: Marin | F36: 7 | I36: =D36+E36+F36+G36+H36 -> 7
A37: =RANK(I37,$I$23:$I$57) -> 14 | B37: Shoja Torabian, 59 | C37: MRW | E37: 4 | F37: 3 | I37: =D37+E37+F37+G37+H37 -> 7
A38: =RANK(I38,$I$23:$I$57) -> 16 | B38: Jeanne Olson, 61 | C38: Impala | G38: 6 | I38: =D38+E38+F38+G38+H38 -> 6
A39: =RANK(I39,$I$23:$I$57) -> 16 | B39: Linda Burnett, 71 | C39: Marin | H39: 6 | I39: =D39+E39+F39+G39+H39 -> 6
A40: =RANK(I40,$I$23:$I$57) -> 18 | B40: Julie Johnson, 74 | C40: Silver State | F40: 5 | I40: =D40+E40+F40+G40+H40 -> 5
A41: =RANK(I41,$I$23:$I$57) -> 18 | B41: Bill Penner, 61 & 62 | C41: PRO | F41: 1 | H41: 4 | I41: =D41+E41+F41+G41+H41 -> 5
A42: =RANK(I42,$I$23:$I$57) -> 20 | B42: John Mullane, Sr., 69 & 70 | C42: SCTC | D42: 4 | I42: =D42+E42+F42+G42+H42 -> 4
A43: =RANK(I43,$I$23:$I$57) -> 21 | B43: Leslie Sokol, 50 | C43: SCTC | E43: 3 | I43: =D43+E43+F43+G43+H43 -> 3
A44: =RANK(I44,$I$23:$I$57) -> 21 | B44: Robyn Stevens, 24 | C44: Unattached | D44: 3 | I44: =D44+E44+F44+G44+H44 -> 3
A45: =RANK(I45,$I$23:$I$57) -> 21 | B45: Jaydeep (JD) Bhatia, 17 | C45: Team Olympians | D45: 1 | E45: 1 | F45: 1 | I45: =D45+E45+F45+G45+H45 -> 3
A46: =RANK(I46,$I$23:$I$57) -> 21 | B46: Alexander Price, 26 | C46: PRO | E46: 1 | F46: 1 | H46: 1 | I46: =D46+E46+F46+G46+H46 -> 3
A47: =RANK(I47,$I$23:$I$57) -> 25 | B47: Rosewitha Albrecht, 69 & 70 | C47: GGRW | D47: 2 | I47: =D47+E47+F47+G47+H47 -> 2
A48: =RANK(I48,$I$23:$I$57) -> 25 | B48: Nicolle Goldman, 49 | C48: SRW | D48: 1 | F48: 1 | I48: =D48+E48+F48+G48+H48 -> 2
A49: =RANK(I49,$I$23:$I$57) -> 25 | B49: Susan Mears, 53 | C49: PRO | F49: 2 | I49: =D49+E49+F49+G49+H49 -> 2
A50: =RANK(I50,$I$23:$I$57) -> 25 | B50: Helen Storrs, 42 | C50: Sierra | F50: 1 | H50: 1 | I50: =D50+E50+F50+G50+H50 -> 2
A51: =RANK(I51,$I$23:$I$57) -> 25 | B51: Terri Brothers, 52 | C51: PRO | H51: 2 | I51: =D51+E51+F51+G51+H51 -> 2
A52: =RANK(I52,$I$23:$I$57) -> 30 | B52: Laura Cribbins, 51 | C52: GGRW | E52: 1 | I52: =D52+E52+F52+G52+H52 -> 1
A53: =RANK(I53,$I$23:$I$57) -> 30 | B53: Rita Hildreth, 76 | C53: PRO | F53: 1 | I53: =D53+E53+F53+G53+H53 -> 1
A54: =RANK(I54,$I$23:$I$57) -> 30 | B54: Steven Popell, 69 | C54: GGRW | E54: 1 | I54: =D54+E54+F54+G54+H54 -> 1
A55: =RANK(I55,$I$23:$I$57) -> 30 | B55: Stu Kinney, 68 | C55: GGRW | H55: 1 | I55: =D55+E55+F55+G55+H55 -> 1
A56: =RANK(I56,$I$23:$I$57) -> 30 | B56: Linda Collier, 64 | C56: PRO | H56: 1 | I56: =D56+E56+F56+G56+H56 -> 1
A58: NOTES: See Race Walking Rules for details. For individuals, 1st place = 10 points; 2nd = 9 pts; 3rd = 8 pts; etc.; 10th place and lower =1.
A59: Only Pacific Association - USATF members score points for the Grand Prix series. Total = best 4 out of 5 races.
A61: Men's Overall (on the basis of speed)
B62: DATE | D62: 39501 | E62: 39593 | F62: 39676 | G62: =G5 -> 39698 | H62: =H5 -> 39740
B63: Location | D63: Los Gatos | E63: San Mateo | F63: Reno | G63: Oakland | H63: =H6 -> Sacramento
A64: PLACE | B64: Walker | C64: Club | D64: 1 Hour | E64: 5K | F64: 3K | G64: 20K | H64: =H7 -> 10K | I64: Total
A66: =RANK(I66,$I$66:$I$81) -> 1 | B66: Joseph Berendt, 52 & 53 | C66: SRW | D66: 8 | E66: 6 | F66: 7 | G66: 10 | H66: 8 | I66: =D66+F66+G66+H66 -> 33
A67: =RANK(I67,$I$66:$I$81) -> 2 | B67: Tyler Sorensen, 14 | C67: Pleasanton Heat | D67: 10 | E67: 10 | H67: 10 | I67: =D67+E67+F67+G67+H67 -> 30
A68: =RANK(I68,$I$66:$I$81) -> 3 | B68: Jaydeep (JD) Bhatia, 17 | C68: Team Olympians | D68: 7 | E68: 7 | F68: 9 | I68: =D68+E68+F68+G68+H68 -> 23
A69: =RANK(I69,$I$66:$I$81) -> 4 | B69: Alexander Price, 26 | C69: PRO | E69: 3 | F69: 8 | H69: 9 | I69: =D69+E69+F69+G69+H69 -> 20
A70: =RANK(I70,$I$66:$I$81) -> 5 | B70: Abderrezak Gharfara, 38 | C70: MRW | E70: 9 | F70: 10 | I70: =D70+E70+F70+G70+H70 -> 19
A71: =RANK(I71,$I$66:$I$81) -> 6 | B71: Kevin Killingsworth, 52 | C71: MRW | D71: 9 | E71: 8 | I71: =D71+E71+F71+G71+H71 -> 17
A72: =RANK(I72,$I$66:$I$81) -> 7 | B72: Shoja Torabian, 59 | C72: MRW | E72: 5 | F72: 5 | I72: =D72+E72+F72+G72+H72 -> 10
A73: =RANK(I73,$I$66:$I$81) -> 8 | B73: Ronald Walters, 69 | C73: SRW | E73: 2 | H73: 7 | I73: =D73+E73+F73+G73+H73 -> 9
A74: =RANK(I74,$I$66:$I$81) -> 9 | B74: Bill Penner, 61 & 62 | C74: PRO | F74: 2 | H74: 6 | I74: =D74+E74+F74+G74+H74 -> 8
A75: =RANK(I75,$I$66:$I$81) -> 10 | B75: Jack Bray, 75 | C75: MRW | E75: 4 | F75: 3 | I75: =D75+E75+F75+G75+H75 -> 7
A76: =RANK(I76,$I$66:$I$81) -> 11 | B76: Ted Moore, 69 | C76: PRO | F76: 6 | I76: =D76+E76+F76+G76+H76 -> 6
A77: =RANK(I77,$I$66:$I$81) -> 11 | B77: John Mullane, Sr., 69 & 70 | C77: SCTC | D77: 6 | I77: =D77+E77+F77+G77+H77 -> 6
A78: =RANK(I78,$I$66:$I$81) -> 13 | B78: Stu Kinney, 68 | C78: GGRW | H78: 5 | I78: =D78+E78+F78+G78+H78 -> 5
A79: =RANK(I79,$I$66:$I$81) -> 14 | B79: James Beckett, 69 | C79: Marin | F79: 4 | I79: =D79+E79+F79+G79+H79 -> 4
A80: =RANK(I80,$I$66:$I$81) -> 15 | B80: Steven Popell, 69 | C80: GGRW | E80: 1 | I80: =D80+E80+F80+G80+H80 -> 1
A83: Women's Overall (on the basis of speed)
B84: DATE | D84: 39501 | E84: 39593 | F84: 39676 | G84: =G5 -> 39698 | H84: =H5 -> 39740
B85: Location | D85: Los Gatos | E85: San Mateo | F85: Reno | G85: Oakland | H85: =H6 -> Sacramento
A86: PLACE | B86: Walker | C86: Club | D86: 1 Hour | E86: 5K | F86: 3K | G86: 20K | H86: =H7 -> 10K | I86: Total
A88: 1 | B88: Kelly Wong, 31 & 32 | C88: GGRW | D88: 9 | E88: 10 | F88: 10 | G88: 10 | I88: =D88+E88+F88+G88+H88 -> 39
A89: 2 | B89: Karen Stoyanowski, 53 | C89: SRW | D89: 7 | E89: 7 | F89: 9 | H89: 9 | I89: =D89+E89+F89+G89+H89 -> 32
A90: 3 | B90: Louise Walters, 68 | C90: SRW | E90: 6 | F90: 6 | G90: 9 | H90: 8 | I90: =D90+E90+F90+G90+H90 -> 29
A91: 4 | B91: Nicolette Sorensen, 12 | C91: Pleasanton Heat | E91: 9 | H91: 10 | I91: =D91+E91+F91+G91+H91 -> 19
A92: 5 | B92: Nicolle Goldman, 49 | C92: SRW | D92: 6 | F92: 7 | I92: =D92+E92+F92+G92+H92 -> 13
A93: 6 | B93: Helen Storrs, 42 | C93: Sierra | F93: 5 | H93: 6 | I93: =D93+E93+F93+G93+H93 -> 11
A94: 7 | B94: Susan Armenta, 34 | C94: Wolfpack Intl | D94: 10 | I94: =D94+E94+F94+G94+H94 -> 10
A95: 8 | B95: M. J. Baglin, 61 | C95: PRO | G95: 8 | I95: =D95+E95+F95+G95+H95 -> 8
A96: 8 | B96: Susan Mears, 53 | C96: PRO | F96: 8 | I96: =D96+E96+F96+G96+H96 -> 8
A97: 8 | B97: Leslie Sokol, 50 | C97: SCTC | E97: 8 | I97: =D97+E97+F97+G97+H97 -> 8
A98: 8 | B98: Robyn Stevens, 24 | C98: Unattached | D98: 8 | I98: =D98+E98+F98+G98+H98 -> 8
A99: 12 | B99: Jeanne Olson, 61 | C99: Impala | G99: 7 | I99: =D99+E99+F99+G99+H99 -> 7
A100: 12 | B100: Terri Brothers, 52 | C100: PRO | H100: 7 | I100: =D100+E100+F100+G100+H100 -> 7
A101: 14 | B101: Rosewitha Albrecht, 69 & 70 | C101: GGRW | D101: 5 | I101: =D101+E101+F101+G101+H101 -> 5
A102: 14 | B102: Laura Cribbins, 51 | C102: GGRW | E102: 5 | I102: =D102+E102+F102+G102+H102 -> 5
A103: 14 | B103: Linda Collier, 64 | C103: PRO | H103: 5 | I103: =D103+E103+F103+G103+H103 -> 5
A104: 17 | B104: Julie Johnson, 74 | C104: Silver State | F104: 4 | I104: =D104+E104+F104+G104+H104 -> 4
A105: 18 | B105: Rita Hildreth, 76 | C105: PRO | F105: 3 | I105: =D105+E105+F105+G105+H105 -> 3