A1: 2008 PA/USATF Grand Prix Standings
H3: updated | I3: 39617
A4: Team: Sierra Racewalkers - currently in first place
B5: DATE | C5: 39501 | D5: 39593 | E5: 39641 | F5: 39676 | H5: 39698 | I5: TBA
B6: Location | C6: Los Gatos | D6: San Mateo | E6: Stockton | F6: Reno | H6: Oakland | I6: Sacramento
A7: PLACE | B7: Club/Distance | C7: 1 Hour | D7: 5K | E7: 1 mile | F7: 3K | H7: 20K | I7: 10K | J7: Total
A8: =RANK(J8,$J$8:$J$14) -> 1 | B8: Sierra Racewalkers | C8: 10 | D8: 8 | J8: =C8+D8 -> 18
B9: Pacific Racewalk Organization | J9: =C9 -> 
B10: Santa Cruz Track Club
A11: =RANK(J11,$J$8:$J$14) -> 2 | B11: Marin Racewalkers | D11: 10 | J11: =C11+D11 -> 10
B12: Monterey Pennisula WWW Club
A13: =RANK(J13,$J$8:$J$14) -> 3 | B13: Golden Gate Racewalkers | D13: 7 | J13: =C13+D13 -> 7
A15: NOTE: See Race Walking Rules for details. For teams, 1st place = 10 points; 2nd = 8 points; 3rd = 7 points; etc.; 9th place and lower =1.
A17: Age Graded (includes women and men together): Tyler Sorensen currently 1st
B18: DATE | D18: 39501 | E18: 39593 | F18: 39641 | H18: 39676 | I18: =H5 -> 39698 | J18: =I5 -> TBA
B19: Location | D19: Los Gatos | E19: San Mateo | F19: Stockton | H19: Reno | I19: Oakland | J19: =I6 -> Sacramento
B20: Walker (age during season) | C20: Club | D20: 1 Hour | E20: 5K | F20: 1 mile | H20: 3K | I20: 20K | J20: =I7 -> 10K | K20: Total
A22: =RANK(K22,$K$22:$K$45) -> 14 | B22: Rosewitha Albrecht, 69 & 70 | C22: GGRW | D22: 2 | K22: =D22+E22+F22+G22+H22+I22+J22 -> 2
A23: =RANK(K23,$K$22:$K$45) -> 5 | B23: Susan Armenta, 34 | C23: Wolfpack Intl | D23: 9 | K23: =D23+E23+F23+G23+H23+I23+J23 -> 9
A24: =RANK(K24,$K$22:$K$45) -> 17 | B24: Laura Cribbins, 51 | C24: GGRW | E24: 1 | K24: =D24+E24+F24+G24+H24+I24+J24 -> 1
A25: =RANK(K25,$K$22:$K$45) -> 17 | B25: Nicolle Goldman, 49 | C25: SRW | D25: 1 | K25: =D25+E25+F25+G25+H25+I25+J25 -> 1
A26: =RANK(K26,$K$22:$K$45) -> 12 | B26: Leslie Sokol, 50 | C26: SCTC | E26: 3 | K26: =D26+E26+F26+G26+H26+I26+J26 -> 3
A27: =RANK(K27,$K$22:$K$45) -> 8 | B27: Nicolette Sorensen, 12 | C27: Pleasanton Heat | E27: 7 | K27: =D27+E27+F27+G27+H27+I27+J27 -> 7
A28: =RANK(K28,$K$22:$K$45) -> 5 | B28: Karen Stoyanowski, 53 | C28: SRW | D28: 8 | E28: 1 | K28: =D28+E28+F28+G28+H28+I28+J28 -> 9
A29: =RANK(K29,$K$22:$K$45) -> 12 | B29: Robyn Stevens, 24 | C29: Unattached | D29: 3 | K29: =D29+E29+F29+G29+H29+I29+J29 -> 3
A30: =RANK(K30,$K$22:$K$45) -> 5 | B30: Louise Walters, 68 | C30: SRW | E30: 9 | K30: =D30+E30+F30+G30+H30+I30+J30 -> 9
A31: =RANK(K31,$K$22:$K$45) -> 3 | B31: Kelly Wong, 32 | C31: GGRW | D31: 5 | E31: 6 | K31: =D31+E31+F31+G31+H31+I31+J31 -> 11
A33: =RANK(K33,$K$22:$K$45) -> 8 | B33: Joseph Berendt, 52 | C33: SRW | D33: 6 | E33: 1 | K33: =D33+E33+F33+G33+H33+I33+J33 -> 7
A34: =RANK(K34,$K$22:$K$45) -> 14 | B34: Jaydeep (JD) Bhatia, 17 | C34: Team Olympians | D34: 1 | E34: 1 | K34: =D34+E34+F34+G34+H34+I34+J34 -> 2
A35: =RANK(K35,$K$22:$K$45) -> 4 | B35: Jack Bray, 75 | C35: MRW | E35: 10 | K35: =D35+E35+F35+G35+H35+I35+J35 -> 10
A36: =RANK(K36,$K$22:$K$45) -> 14 | B36: Abderrezak Gharfara, 38 | C36: MRW | E36: 2 | K36: =D36+E36+F36+G36+H36+I36+J36 -> 2
A37: =RANK(K37,$K$22:$K$45) -> 2 | B37: Kevin Killingsworth, 52 | C37: MRW | D37: 7 | E37: 5 | K37: =D37+E37+F37+G37+H37+I37+J37 -> 12
A38: =RANK(K38,$K$22:$K$45) -> 10 | B38: John Mullane, Sr., 69 & 70 | C38: SCTC | D38: 4 | K38: =D38+E38+F38+G38+H38+I38+J38 -> 4
A39: =RANK(K39,$K$22:$K$45) -> 17 | B39: Steven Popell, 69 | C39: GGRW | E39: 1 | K39: =D39+E39+F39+G39+H39+I39+J39 -> 1
A40: =RANK(K40,$K$22:$K$45) -> 17 | B40: Alexander Price, 26 | C40: PRO | E40: 1 | K40: =D40+E40+F40+G40+H40+I40+J40 -> 1
A41: =RANK(K41,$K$22:$K$45) -> 1 | B41: Tyler Sorensen, 14 | C41: Pleasanton Heat | D41: 10 | E41: 8 | K41: =D41+E41+F41+G41+H41+I41+J41 -> 18
A42: =RANK(K42,$K$22:$K$45) -> 10 | B42: Shoja Torabian, 59 | C42: MRW | E42: 4 | K42: =D42+E42+F42+G42+H42+I42+J42 -> 4
A43: =RANK(K43,$K$22:$K$45) -> 17 | B43: Ronald Walters, 69 | C43: SRW | E43: 1 | K43: =D43+E43+F43+G43+H43+I43+J43 -> 1
A46: NOTES: See Race Walking Rules for details. For individuals, 1st place = 10 points; 2nd = 9 pts; 3rd = 8 pts; etc.; 10th place and lower =1.
A52: Men's Overall (on the basis of speed): Tyler Sorensen is currently in fist place.
B53: DATE | D53: 39501 | E53: 39593 | F53: 39641 | H53: 39676 | I53: =H5 -> 39698 | J53: =I5 -> TBA
B54: Location | D54: Los Gatos | E54: San Mateo | F54: Stockton | H54: Reno | I54: Oakland | J54: =I6 -> Sacramento
A55: PLACE | B55: Walker | C55: Club | D55: 1 Hour | E55: 5K | F55: 1 mile | H55: 3K | I55: 20K | J55: =I7 -> 10K | K55: Total
A57: =RANK(K57,$K$57:$K$69) -> 4 | B57: Joseph Berendt, 52 | C57: SRW | D57: 8 | E57: 6 | K57: =D57 -> 8
A58: =RANK(K58,$K$57:$K$69) -> 5 | B58: Jaydeep (JD) Bhatia, 17 | C58: Team Olympians | D58: 7 | E58: 7 | K58: =D58 -> 7
A59: =RANK(K59,$K$57:$K$69) -> 8 | B59: Jack Bray, 75 | C59: MRW | E59: 4 | K59: =D59+E59+F59+G59+H59+I59+J59 -> 4
A60: =RANK(K60,$K$57:$K$69) -> 2 | B60: Abderrezak Gharfara, 38 | C60: MRW | E60: 9 | K60: =D60+E60+F60+G60+H60+I60+J60 -> 9
A61: =RANK(K61,$K$57:$K$69) -> 2 | B61: Kevin Killingsworth, 52 | C61: MRW | D61: 9 | E61: 8 | K61: =D61 -> 9
A62: =RANK(K62,$K$57:$K$69) -> 6 | B62: John Mullane, Sr., 69 & 70 | C62: SCTC | D62: 6 | K62: =D62 -> 6
A63: =RANK(K63,$K$57:$K$69) -> 11 | B63: Steven Popell, 69 | C63: GGRW | E63: 1 | K63: =D63+E63+F63+G63+H63+I63+J63 -> 1
A64: =RANK(K64,$K$57:$K$69) -> 9 | B64: Alexander Price, 26 | C64: PRO | E64: 3 | K64: =D64+E64+F64+G64+H64+I64+J64 -> 3
A65: =RANK(K65,$K$57:$K$69) -> 1 | B65: Tyler Sorensen, 14 | C65: Pleasanton Heat | D65: 10 | E65: 10 | K65: =D65 -> 10
A66: =RANK(K66,$K$57:$K$69) -> 7 | B66: Shoja Torabian, 59 | C66: MRW | E66: 5 | K66: =D66+E66+F66+G66+H66+I66+J66 -> 5
A67: =RANK(K67,$K$57:$K$69) -> 10 | B67: Ronald Walters, 69 | C67: SRW | E67: 2 | K67: =D67+E67+F67+G67+H67+I67+J67 -> 2
A70: NOTES: See Race Walking Rules for details. For individuals, 1st place = 10 points; 2nd = 9 pts; 3rd = 8 pts; etc.; 10th place and lower =1.
A72: Women's Overall (on the basis of speed): Karen Stoyanowski is currently 1st
B73: DATE | D73: 39501 | E73: 39593 | F73: 39641 | H73: 39676 | I73: =H5 -> 39698 | J73: =I5 -> TBA
B74: Location | D74: Los Gatos | E74: San Mateo | F74: Stockton | H74: Reno | I74: Oakland | J74: =I6 -> Sacramento
A75: PLACE | B75: Walker | C75: Club | D75: 1 Hour | E75: 5K | F75: 1 mile | H75: 3K | I75: 20K | J75: =I7 -> 10K | K75: Total
A77: =RANK(K77,$K$77:$K$88) -> 9 | B77: Rosewitha Albrecht, 69 & 70 | C77: GGRW | D77: 5 | K77: =D77+E77+F77+G77+H77+I77+J77 -> 5
A78: =RANK(K78,$K$77:$K$88) -> 3 | B78: Susan Armenta, 34 | C78: Wolfpack Intl | D78: 10 | K78: =D78+E78+F78+G78+H78+I78+J78 -> 10
A79: =RANK(K79,$K$77:$K$88) -> 9 | B79: Laura Cribbins, 51 | C79: GGRW | E79: 5 | K79: =D79+E79+F79+G79+H79+I79+J79 -> 5
A80: =RANK(K80,$K$77:$K$88) -> 7 | B80: Nicolle Goldman, 49 | C80: SRW | D80: 6 | K80: =D80+E80+F80+G80+H80+I80+J80 -> 6
A81: =RANK(K81,$K$77:$K$88) -> 5 | B81: Leslie Sokol, 50 | C81: SCTC | E81: 8 | K81: =D81+E81+F81+G81+H81+I81+J81 -> 8
A82: =RANK(K82,$K$77:$K$88) -> 4 | B82: Nicolette Sorensen, 12 | C82: Pleasanton Heat | E82: 9 | K82: =D82+E82+F82+G82+H82+I82+J82 -> 9
A83: =RANK(K83,$K$77:$K$88) -> 2 | B83: Karen Stoyanowski, 53 | C83: SRW | D83: 7 | E83: 7 | K83: =D83+E83+F83+G83+H83+I83+J83 -> 14
A84: =RANK(K84,$K$77:$K$88) -> 5 | B84: Robyn Stevens, 24 | C84: Unattached | D84: 8 | K84: =D84+E84+F84+G84+H84+I84+J84 -> 8
A85: =RANK(K85,$K$77:$K$88) -> 7 | B85: Louise Walters, 68 | C85: SRW | E85: 6 | K85: =D85+E85+F85+G85+H85+I85+J85 -> 6
A86: =RANK(K86,$K$77:$K$88) -> 1 | B86: Kelly Wong, 31 & 32 | C86: GGRW | D86: 9 | E86: 10 | K86: =D86+E86+F86+G86+H86+I86+J86 -> 19
A89: NOTES: See Race Walking Rules for details. For individuals, 1st place = 10 points; 2nd = 9 pts; 3rd = 8 pts; etc.; 10th place and lower =1.