F10: USATF Pacific | G10: Time | I10: Place | J10: Age | K10: Place by
A11: First Name | B11: Last Name | C11: Age | D11: Sex (f/m) | E11: Club | F11: Association? | G11: Min. | H11: Sec. | I11: by speed | J11: Graded % | K11: Age Graded %
A12: Kelly | B12: Wong | C12: 31 | D12: f | E12: GGRW | F12: yes | G12: 15 | H12: 34.1 | I12: F1 | J12: 0.7443314420297612 | K12: 14
A13: Laura | B13: Carnagie | C13: 34 | D13: f | F13: no | G13: 17 | H13: 31.8 | I13: F2 | J13: 0.66476516447993927 | K13: 19
A14: M.J. | B14: Baglin | C14: 60 | D14: f | E14: PRO | F14: yes | G14: 18 | H14: 0.3 | I14: F3 | J14: 0.79828751272794596 | K14: 8
A15: Susan | B15: Mears | C15: 52 | D15: f | E15: PRO | F15: yes | G15: 18 | H15: 1.5 | I15: F4 | J15: 0.73679149329634774 | K15: 16
A16: Kathleen | B16: Frable | C16: 61 | D16: f | F16: no | G16: 18 | H16: 40.3 | I16: F5 | J16: 0.77838079085959122 | K16: 10
A17: Louise | B17: Walters | C17: 67 | D17: f | E17: SRW | F17: yes | G17: 18 | H17: 54.4 | I17: F6 | J17: 0.82635754583921006 | K17: 6
A18: Karen | B18: Stoyanowski | C18: 52 | D18: f | E18: SRW | F18: yes | G18: 19 | H18: 35.6 | I18: F7 | J18: 0.67781558353181359 | K18: 18
A19: Shirley | B19: Dockstader | C19: 74 | D19: f | E19: MRW | F19: yes | G19: 20 | H19: 30.3 | I19: F8 | J19: 0.8421360643745428 | K19: 4
A20: Betsy | B20: Miarecki | C20: 45 | D20: f | E20: Western Women | F20: yes | G20: 20 | H20: 57.5 | I20: F9 | J20: 0.59749502982107361 | K20: 22
A21: Andree | B21: Enos | C21: 38 | D21: f | E21: PRO | F21: yes | G21: 21 | H21: 15.5 | I21: F10 | J21: 0.55828302626421011 | K21: 23
A22: Julie | B22: Johnson | C22: 73 | D22: f | E22: SSS | F22: yes | G22: 22 | H22: 46.4 | I22: F11 | J22: 0.74667740046838404 | K22: 13
A23: Rita | B23: Hildreth | C23: 75 | D23: f | E23: SSS | F23: yes | G23: 25 | H23: 16.3 | I23: F12 | J23: 0.69426234913935236 | K23: 17
A24: Elizabeth | B24: King | C24: 51 | D24: f | F24: no | G24: 32 | H24: 28.7 | I24: F13 | J24: 0.40532662800841585 | K24: 24
A25: Mark | B25: Green | C25: 51 | D25: m | E25: PEB | F25: yes | G25: 13 | H25: 52.1 | I25: M1 | J25: 0.87614469414733798 | K25: 2
A26: Abderrezak | B26: Gharfara | C26: 38 | D26: m | E26: MRW | F26: yes | G26: 14 | H26: 47.9 | I26: M2 | J26: 0.73914855276495095 | K26: 15
A27: Norman | B27: Frable | C27: 61 | D27: m | F27: no | G27: 15 | H27: 51.8 | I27: M3 | J27: 0.83963017440638787 | K27: 5
A28: Alexander | B28: Price | C28: 25 | D28: m | E28: PRO | F28: yes | G28: 16 | H28: 17.2 | I28: M4 | J28: 0.64615227179697088 | K28: 21
A29: Bill | B29: Penner | C29: 60 | D29: m | E29: PRO | F29: yes | G29: 16 | H29: 53.0 | I29: M5 | J29: 0.78109575518262586 | K29: 9
A30: Ted | B30: Moore | C30: 68 | D30: m | E30: PRO | F30: yes | G30: 17 | H30: 0.5 | I30: M6 | J30: 0.84503674669279771 | K30: 3
A31: James | B31: Beckett | C31: 68 | D31: m | E31: MRW | F31: yes | G31: 17 | H31: 33.4 | I31: M7 | J31: 0.81864438959559516 | K31: 7
A32: Jack | B32: Bray | C32: 74 | D32: m | E32: MRW | F32: yes | G32: 17 | H32: 34.7 | I32: M8 | J32: 0.88104674314971076 | K32: 1
A33: Ronald | B33: Walters | C33: 69 | D33: m | E33: SRW | F33: yes | G33: 19 | H33: 19.3 | I33: M9 | J33: 0.752704218062624 | K33: 12
A34: Ed | B34: Lane | C34: 71 | D34: m | E34: MRW | F34: yes | G34: 19 | H34: 47.1 | I34: M10 | J34: 0.75318844242271088 | K34: 11
A35: Michael | B35: Polish | C35: 65 | D35: m | E35: Unattached | F35: yes | G35: 21 | H35: 16.4 | I35: M11 | J35: 0.65305546850517071 | K35: 20
A38: Team Results: Team score is average of top 3 age grade percentages.
A40: Team | B40: Score | C40: Rank | D40: Points
A41: MRW | B41: =AVERAGE(J19,J32,J31) -> 0.84727573237328302 | C41: =RANK(B41,$B$41:$B$44) -> 1 | D41: =IF(C41=1,10,10-C41) -> 10
A42: SRW | B42: =AVERAGE(J18,J19,J34) -> 0.75771336344302254 | C42: =RANK(B42,$B$41:$B$44) -> 3 | D42: =IF(C42=1,10,10-C42) -> 7
A43: PRO | B43: =AVERAGE(J30,J14,J29) -> 0.80814000486778992 | C43: =RANK(B43,$B$41:$B$44) -> 2 | D43: =IF(C43=1,10,10-C43) -> 8
A46: Notes: | B46: All individuals listed finished the race without being disqualified. There were no disqualifications among the either the women or men.
B47: An anonymous donor provided prize money for the top three age-graded race walkers. They were:
B48: First Place to Jack Bray ($1,000), Second Place to Mark Green ($500); and Third Place to Ted Moore ($250).
B49: Seven individuals age graded better than 80%.
B50: Pending approvals, it appears that Jack Bray broke the American record for Age 70-74, and
B51: that Norm Frable broke the American record for Age 60-64.
B52: Race conditions: Elevation = 4540 feet (1384 meters) above sea level.
B53: Temperature ~68F (20C) at start of the women's race (7:15 a.m.); ~72F (22C) at start of men's race (8:10 a.m.).
B54: Winds were calm for both races. There was no smoke in the air from wildfires that had been burning nearby in recent days.
A56: Judges: | B56: For the Women's Race: Dick Petruzzi (Chief Judge), Beth Price, Jon Price, Sue Blochwitz, and Mark Green
B57: For the Men's Race: Dick Petruzzi (Chief Judge), Beth Price, Jon Price, M.J. Baglin, and Susan Mears
A59: Recorder: | B59: Rita Hildreth
B61: Rita Hildreth also served as an apprentice judge for the men's race.