D3: Posted on: | E3: 39439 | K3: Location: | L3: Seaside
A5: Individual Results
F6: USATF Pacific | G6: Time | J6: Place | K6: Age | L6: Place by
A7: First Name | B7: Last Name | C7: Age | D7: Sex (M/F) | E7: Club | F7: Association? | G7: Hr. | H7: Min. | I7: Sec. | J7: by speed | K7: Graded % | L7: Age Graded %
A8: Kelly | B8: Wong | C8: 31 | D8: F | E8: GGRW | F8: yes | G8: 0 | H8: 55 | I8: 12 | J8: F1 | K8: 0.7421437198067633 | L8: 8
A9: Alexander | B9: Price | C9: 25 | D9: M | E9: PRO | F9: yes | G9: 0 | H9: 57 | I9: 46 | J9: M1 | K9: 0.64368147720715518 | L9: 17
A10: Joe | B10: Berendt | C10: 52 | D10: M | E10: Sierra | F10: yes | G10: 0 | H10: 58 | I10: 2 | J10: M2 | K10: 0.73875646180356114 | L10: 9
A11: Bill | B11: Penner | C11: 61 | D11: M | E11: PRO | F11: yes | G11: 1 | H11: 0 | I11: 0 | J11: M3 | K11: 0.77533055555555552 | L11: 5
A12: James | B12: Beckett | C12: 69 | D12: M | E12: Marin | F12: yes | G12: 1 | H12: 0 | I12: 54 | J12: M4 | K12: 0.83467432950191578 | L12: 2
A13: Jaydeep | B13: Bhatia | C13: 16 | D13: M | E13: Olympians | F13: yes | G13: 1 | H13: 1 | I13: 16 | J13: M5 | K13: 0.64640369967355815 | L13: 16
A14: Karen | B14: Stoyanowski | C14: 52 | D14: F | E14: Sierra | F14: yes | G14: 1 | H14: 2 | I14: 40 | J14: F2 | K14: 0.75518085106382982 | L14: 7
A15: Louise | B15: Walters | C15: 67 | D15: F | E15: Sierra | F15: yes | G15: 1 | H15: 3 | I15: 23 | J15: F3 | K15: 0.89869050749408352 | L15: 1
A16: Leslie | B16: Sokol | C16: 50 | D16: F | E16: SCTC | F16: yes | G16: 1 | H16: 3 | I16: 27 | J16: F4 | K16: 0.73115576569477281 | L16: 10
A17: MJ | B17: Baglin | C17: 60 | D17: F | E17: PRO | F17: yes | G17: 1 | H17: 4 | I17: 19 | J17: F5 | K17: 0.8052267426794506 | L17: 4
A18: Susan | B18: Mears | C18: 52 | D18: F | E18: PRO | F18: yes | G18: 1 | H18: 5 | I18: 47 | J18: F6 | K18: 0.71940207752723584 | L18: 11
A19: Ron | B19: Walters | C19: 69 | D19: M | E19: Sierra | F19: yes | G19: 1 | H19: 6 | I19: 25 | J19: M6 | K19: 0.76534504391468006 | L19: 6
A20: Hansi | B20: Rigney | C20: 66 | D20: F | E20: MPWWWC | F20: yes | G20: 1 | H20: 7 | I20: 35 | J20: F7 | K20: 0.83059432799013566 | L20: 3
A21: Quang | B21: Than | C21: 52 | D21: M | E21: MPWWWC | F21: yes | G21: 1 | H21: 7 | I21: 48 | J21: M7 | K21: 0.63233775811209436 | L21: 18
A22: Andree | B22: Enos | C22: 38 | D22: F | E22: PRO | F22: yes | G22: 1 | H22: 9 | I22: 42 | J22: F8 | K22: 0.60196556671449064 | L22: 20
A23: Marge | B23: Garnero | C23: 66 | D23: M | E23: MPWWWC | F23: yes | G23: 1 | H23: 12 | I23: 10 | J23: F9 | K23: 0.68000923787528866 | L23: 15
A24: Joe | B24: Anderson | C24: 68 | D24: M | E24: SCTC | F24: yes | G24: 1 | H24: 12 | I24: 13 | J24: M8 | K24: 0.69550888529886912 | L24: 14
A25: John | B25: Mullane | C25: 69 | D25: M | E25: SCTC | F25: yes | G25: 1 | H25: 12 | I25: 18 | J25: M9 | K25: 0.70306592899953901 | L25: 13
A26: Stu | B26: Kinney | C26: 67 | D26: M | E26: GGRW | F26: yes | G26: 1 | H26: 20 | I26: 14 | J26: M10 | K26: 0.61866223514748642 | L26: 19
A27: Rich | B27: Hansen | C27: 81 | D27: M | E27: GGRW | F27: yes | G27: 1 | H27: 25 | I27: 40 | J27: M11 | K27: 0.70450778210116738 | L27: 12
A29: Team Results: Team score is average of top 3 age grade percentages.
A31: Team | B31: Score | C31: Rank | D31: Points
A32: Sierra | B32: =AVERAGE(K15,K19,K14) -> 0.8064054674908645 | C32: 1 | D32: 10
A33: PRO | B33: =AVERAGE(K11,K17,K18) -> 0.76665312525408069 | C33: 2 | D33: 8
A34: MPWWWC | B34: =AVERAGE(K20,K21,K23) -> 0.71431377465917301 | C34: 3 | D34: 7
A35: SCTC | B35: =AVERAGE(K16,K24,K25) -> 0.70991019333106031 | C35: 4 | D35: 6
A36: GGRW | B36: =AVERAGE(K8,K26,K27) -> 0.68843791235180574 | C36: 5 | D36: 5