A1: Place | B1: Bib | C1: First Name | D1: Last Name | E1: Age | F1: Gender | G1: Time
A2: 1 | B2: 125 | C2: Steve | D2: Stowers | E2: 41 | F2: M | G2: 0.15376157407407406
A3: =A2+1 -> 2 | B3: 151 | C3: Richie | D3: Boulet | E3: 34 | F3: M | G3: 0.15842592592592594
A4: =A3+1 -> 3 | B4: 71 | C4: Jean | D4: Pommier | E4: 43 | F4: M | G4: 0.15850694444444444
A5: =A4+1 -> 4 | B5: 155 | C5: Chikara | D5: Omine | E5: 24 | F5: M | G5: 0.16704861111111111
A6: =A5+1 -> 5 | B6: 118 | C6: Oswaldo | D6: Lopez | E6: 35 | F6: M | G6: 0.16945601851851852
A7: =A6+1 -> 6 | B7: 122 | C7: Juan | D7: Sanchez | E7: 38 | F7: M | G7: 0.17226851851851852
A8: =A7+1 -> 7 | B8: 47 | C8: Ron | D8: Guiterrez | E8: 40 | F8: M | G8: 0.17831018518518518
A9: =A8+1 -> 8 | B9: 62 | C9: Mark | D9: Tanaka | E9: 40 | F9: M | G9: 0.18047453703703706
A10: =A9+1 -> 9 | B10: 69 | C10: Joe | D10: Schieffer | E10: 56 | F10: M | G10: 0.18813657407407405
A11: =A10+1 -> 10 | B11: 90 | C11: Caren | D11: Spore | E11: 39 | F11: F | G11: 0.18862268518518518
A12: =A11+1 -> 11 | B12: 148 | C12: Jed | D12: Tuckman | E12: 36 | F12: M | G12: 0.1915162037037037
A13: =A12+1 -> 12 | B13: 55 | C13: Joseph | D13: Swenson | E13: 52 | F13: M | G13: 0.19380787037037037
A14: =A13+1 -> 13 | B14: 109 | C14: Karalee | D14: Morris | E14: 29 | F14: F | G14: 0.19489583333333335
A15: =A14+1 -> 14 | B15: 103 | C15: Richard | D15: Averett | E15: 54 | F15: M | G15: 0.19822916666666668
A16: =A15+1 -> 15 | B16: 150 | C16: David | D16: La Duc | E16: 37 | F16: M | G16: 0.19892361111111112
A17: =A16+1 -> 16 | B17: 114 | C17: Wayne | D17: Miles | E17: 61 | F17: M | G17: 0.19917824074074075
A18: =A17+1 -> 17 | B18: 120 | C18: Lainie | D18: Callahan-Mattoon | E18: 31 | F18: F | G18: 0.2016435185185185
A19: =A18+1 -> 18 | B19: 95 | C19: Ted | D19: Nunes | E19: 30 | F19: M | G19: 0.20195601851851852
A20: =A19+1 -> 19 | B20: 79 | C20: Marty | D20: Hoffman | E20: 51 | F20: M | G20: 0.20260416666666667
A21: =A20+1 -> 20 | B21: 82 | C21: Keith | D21: Blom | E21: 50 | F21: M | G21: 0.2026273148148148
A22: =A21+1 -> 21 | B22: 67 | C22: Brian | D22: Koo | E22: 59 | F22: M | G22: 0.20431712962962964
A23: =A22+1 -> 22 | B23: 93 | C23: Cecil | D23: Baumgartner | E23: 51 | F23: M | G23: 0.20528935185185185
A24: =A23+1 -> 23 | B24: 145 | C24: Andy | D24: Black | E24: 49 | F24: M | G24: 0.20559027777777775
A25: =A24+1 -> 24 | B25: 24 | C25: Stephen | D25: Itano | E25: 48 | F25: M | G25: 0.20560185185185187
A26: =A25+1 -> 25 | B26: 100 | C26: Jeffrey | D26: Barbier | E26: 42 | F26: M | G26: 0.20638888888888887
A27: =A26+1 -> 26 | B27: 35 | C27: Marian | D27: Richard | E27: 47 | F27: F | G27: 0.20640046296296297
A28: =A27+1 -> 27 | B28: 70 | C28: Layne | D28: Kemp | E28: 42 | F28: M | G28: 0.2066550925925926
A29: =A28+1 -> 28 | B29: 72 | C29: Dan | D29: Burke | E29: 48 | F29: M | G29: 0.20704861111111109
A30: =A29+1 -> 29 | B30: 136 | C30: Tim | D30: Quinn | E30: 60 | F30: M | G30: 0.20829861111111111
A31: =A30+1 -> 30 | B31: 126 | C31: James | D31: Barstad | E31: 43 | F31: M | G31: 0.20848379629629629
A32: =A31+1 -> 31 | B32: 142 | C32: Carrie | D32: Sisk | E32: 32 | F32: F | G32: 0.20898148148148146
A33: =A32+1 -> 32 | B33: 111 | C33: Peter | D33: Hsia | E33: 47 | F33: M | G33: 0.21086805555555554
A34: =A33+1 -> 33 | B34: 49 | C34: Al | D34: Brosio | E34: 63 | F34: M | G34: 0.21172453703703706
A35: =A34+1 -> 34 | B35: 98 | C35: Rena | D35: Schumann | E35: 46 | F35: F | G35: 0.21285879629629631
A36: =A35+1 -> 35 | B36: 152 | C36: Charles | D36: Duerig | E36: 50 | F36: M | G36: 0.21297453703703703
A37: =A36+1 -> 36 | B37: 104 | C37: Julie | D37: Nye | E37: 44 | F37: F | G37: 0.21662037037037038
A38: =A37+1 -> 37 | B38: 106 | C38: Rob | D38: Byrne | E38: 49 | F38: M | G38: 0.2167361111111111
A39: =A38+1 -> 38 | B39: 81 | C39: Grant | D39: Carboni | E39: 36 | F39: M | G39: 0.21827546296296296
A40: =A39+1 -> 39 | B40: 38 | C40: Hannes | D40: Vogel | E40: 54 | F40: M | G40: 0.21969907407407407
A41: =A40+1 -> 40 | B41: 96 | C41: Eric | D41: Vaughan | E41: 47 | F41: M | G41: 0.21976851851851853
A42: =A41+1 -> 41 | B42: 28 | C42: Adam | D42: Blum | E42: 43 | F42: M | G42: 0.22041666666666668
A43: =A42+1 -> 42 | B43: 124 | C43: Joe | D43: Kelso | E43: 31 | F43: M | G43: 0.22050925925925927
A44: =A43+1 -> 43 | B44: 137 | C44: Doug | D44: Bond | E44: 44 | F44: M | G44: 0.22107638888888889
A45: =A44+1 -> 44 | B45: 78 | C45: Roberta | D45: McGraw | E45: 45 | F45: F | G45: 0.22466435185185185
A46: =A45+1 -> 45 | B46: 144 | C46: Roy | D46: Pena | E46: 49 | F46: M | G46: 0.22482638888888887
A47: =A46+1 -> 46 | B47: 131 | C47: Elizabeth | D47: Everly | E47: 38 | F47: F | G47: 0.22497685185185187
A48: =A47+1 -> 47 | B48: 112 | C48: Jan | D48: Jazwinski | E48: 57 | F48: M | G48: 0.22533564814814813
A49: =A48+1 -> 48 | B49: 133 | C49: Howard | D49: Wood | E49: 42 | F49: M | G49: 0.22598379629629628
A50: =A49+1 -> 49 | B50: 63 | C50: Jason | D50: Whipple | E50: 39 | F50: M | G50: 0.2260763888888889
A51: =A50+1 -> 50 | B51: 36 | C51: Tamara | D51: Johnson | E51: 42 | F51: F | G51: 0.22715277777777779
A52: =A51+1 -> 51 | B52: 117 | C52: Lupe | D52: Labourdett | E52: 48 | F52: F | G52: 0.22715277777777779
A53: =A52+1 -> 52 | B53: 102 | C53: Todd | D53: Hayes | E53: 57 | F53: M | G53: 0.2278935185185185
A54: =A53+1 -> 53 | B54: 91 | C54: Thomas | D54: McManus | E54: 37 | F54: M | G54: 0.22820601851851852
A55: =A54+1 -> 54 | B55: 85 | C55: Mike | D55: Hernandez | E55: 54 | F55: M | G55: 0.22908564814814814
A56: =A55+1 -> 55 | B56: 73 | C56: Alan | D56: Barnes | E56: 51 | F56: M | G56: 0.23138888888888889
A57: =A56+1 -> 56 | B57: 130 | C57: Tom | D57: Alber | E57: 53 | F57: M | G57: 0.23354166666666668
A58: =A57+1 -> 57 | B58: 64 | C58: Amanda | D58: Ferguson | E58: 29 | F58: F | G58: 0.23518518518518516
A59: =A58+1 -> 58 | B59: 129 | C59: Jerry | D59: Roninger | E59: 61 | F59: M | G59: 0.23569444444444443
A60: =A59+1 -> 59 | B60: 34 | C60: Ingrid | D60: Randazzo | E60: 36 | F60: F | G60: 0.23594907407407406
A61: =A60+1 -> 60 | B61: 89 | C61: Jeff | D61: Jones | E61: 53 | F61: M | G61: 0.23766203703703703
A62: =A61+1 -> 61 | B62: 138 | C62: Bob | D62: Cowdrey | E62: 63 | F62: M | G62: 0.24047453703703703
A63: =A62+1 -> 62 | B63: 140 | C63: Steven | D63: Patt | E63: 58 | F63: M | G63: 0.2409375
A64: =A63+1 -> 63 | B64: 43 | C64: Kyong | D64: Martin | E64: 52 | F64: F | G64: 0.24130787037037038
A65: =A64+1 -> 64 | B65: 51 | C65: Laura | D65: Yasso | E65: 47 | F65: F | G65: 0.2426851851851852
A66: =A65+1 -> 65 | B66: 77 | C66: Lisa | D66: Huerta | E66: 45 | F66: F | G66: 0.24446759259259257
A67: =A66+1 -> 66 | B67: 110 | C67: Robert | D67: Cervero | E67: 56 | F67: M | G67: 0.24644675925925927
A68: =A67+1 -> 67 | B68: 123 | C68: Jeff | D68: Johnston | E68: 42 | F68: M | G68: 0.24733796296296295
A69: =A68+1 -> 68 | B69: 101 | C69: Dan | D69: Dibley | E69: 38 | F69: M | G69: 0.24789351851851851
A70: =A69+1 -> 69 | B70: 115 | C70: Jay | D70: Elkerton | E70: 49 | F70: M | G70: 0.24858796296296296
A71: =A70+1 -> 70 | B71: 59 | C71: Genevieve | D71: Callahan | E71: 49 | F71: F | G71: 0.24884259259259259
A72: =A71+1 -> 71 | B72: 58 | C72: Meg | D72: Deverin | E72: 26 | F72: F | G72: 0.24930555555555556
A73: =A72+1 -> 72 | B73: 52 | C73: Andrew | D73: Wong | E73: 24 | F73: M | G73: 0.25194444444444447
A74: =A73+1 -> 73 | B74: 84 | C74: Charles | D74: Savage | E74: 59 | F74: M | G74: 0.25208333333333333
A75: =A74+1 -> 74 | B75: 108 | C75: Christine | D75: Flaherty | E75: 54 | F75: F | G75: 0.25305555555555553
A76: =A75+1 -> 75 | B76: 42 | C76: Bradley | D76: Niess | E76: 28 | F76: M | G76: 0.25334490740740739
A77: =A76+1 -> 76 | B77: 143 | C77: Don | D77: Lundell | E77: 45 | F77: M | G77: 0.25354166666666667
A78: =A77+1 -> 77 | B78: 33 | C78: Alexandra | D78: Dronkers | E78: 55 | F78: F | G78: 0.25405092592592593
A79: =A78+1 -> 78 | B79: 75 | C79: Nike | D79: Krasopoulos | E79: 33 | F79: F | G79: 0.25593749999999998
A80: =A79+1 -> 79 | B80: 149 | C80: Mathew | D80: Geis | E80: 35 | F80: M | G80: 0.25624999999999998
A81: =A80+1 -> 80 | B81: 105 | C81: Marcie | D81: Bochenek | E81: 35 | F81: F | G81: 0.25630787037037034
A82: =A81+1 -> 81 | B82: 88 | C82: Buzz | D82: Higgins | E82: 63 | F82: M | G82: 0.25636574074074076
A83: =A82+1 -> 82 | B83: 132 | C83: Tommy | D83: Gallagher | E83: 50 | F83: M | G83: 0.25715277777777779
A84: =A83+1 -> 83 | B84: 68 | C84: Gard | D84: Leighton | E84: 73 | F84: M | G84: 0.2593287037037037
A85: =A84+1 -> 84 | B85: 147 | C85: Chuck | D85: Wilson | E85: 58 | F85: M | G85: 0.2621412037037037
A86: =A85+1 -> 85 | B86: 113 | C86: Kathy | D86: Martin | E86: 57 | F86: F | G86: 0.26238425925925929
A87: =A86+1 -> 86 | B87: 80 | C87: Leslie | D87: Lindquist | E87: 33 | F87: F | G87: 0.26255787037037037
A88: =A87+1 -> 87 | B88: 31 | C88: Jim | D88: Harman | E88: 66 | F88: M | G88: 0.26347222222222222
A89: =A88+1 -> 88 | B89: 37 | C89: Jude | D89: Radeski | E89: 45 | F89: M | G89: 0.26467592592592593
A90: =A89+1 -> 89 | B90: 54 | C90: Matt | D90: Rau | E90: 27 | F90: M | G90: 0.26473379629629629
A91: =A90+1 -> 90 | B91: 50 | C91: Bruce | D91: McDowell | E91: 53 | F91: M | G91: 0.26497685185185188
A92: =A91+1 -> 91 | B92: 29 | C92: Lauren | D92: Wincze | E92: 30 | F92: F | G92: 0.26538194444444446
A93: =A92+1 -> 92 | B93: 146 | C93: Paul | D93: Weller | E93: 41 | F93: M | G93: 0.26711805555555557
A94: =A93+1 -> 93 | B94: 139 | C94: Dan | D94: Blong | E94: 34 | F94: M | G94: 0.26844907407407409
A95: =A94+1 -> 94 | B95: 127 | C95: Kimberly | D95: Matthews | E95: 39 | F95: F | G95: 0.27006944444444442
A96: =A95+1 -> 95 | B96: 107 | C96: Carl | D96: Jacob | E96: 54 | F96: M | G96: 0.27087962962962964
A97: =A96+1 -> 96 | B97: 32 | C97: Chad | D97: Audet | E97: 37 | F97: M | G97: 0.27291666666666664
A98: =A97+1 -> 97 | B98: 86 | C98: Eric | D98: Ianacone | E98: 60 | F98: M | G98: 0.27962962962962962
A99: =A98+1 -> 98 | B99: 154 | C99: Lisa | D99: Felder | E99: 60 | F99: F | G99: 0.28069444444444441
A100: =A99+1 -> 99 | B100: 66 | C100: Ofie | D100: Cruz | E100: 52 | F100: F | G100: 0.28248842592592593
A101: =A100+1 -> 100 | B101: 141 | C101: Linda | D101: Hurd | E101: 45 | F101: F | G101: 0.28290509259259261
A102: =A101+1 -> 101 | B102: 87 | C102: Jim | D102: Richards | E102: 50 | F102: M | G102: 0.284212962962963
A103: =A102+1 -> 102 | B103: 153 | C103: Arnold | D103: Ramos | E103: 56 | F103: M | G103: 0.284212962962963
A104: =A103+1 -> 103 | B104: 97 | C104: Clement | D104: Choy | E104: 60 | F104: M | G104: 0.28449074074074071
A105: =A104+1 -> 104 | B105: 74 | C105: Bev | D105: Vreeland | E105: 51 | F105: F | G105: 0.28905092592592591
A106: =A105+1 -> 105 | B106: 134 | C106: Jessie | D106: Campbell | E106: 27 | F106: F | G106: 0.28905092592592591
A107: =A106+1 -> 106 | B107: 116 | C107: David | D107: Dixon | E107: 58 | F107: M | G107: 0.28990740740740745
A108: =A107+1 -> 107 | B108: 92 | C108: Ron | D108: Peck | E108: 65 | F108: M | G108: 0.29728009259259258
A109: =A108+1 -> 108 | B109: 83 | C109: Scott | D109: Fulton | E109: 37 | F109: M | G109: 0.30884259259259256
A110: =A109+1 -> 109 | B110: 44 | C110: Jeff | D110: Martin | E110: 60 | F110: M | G110: 0.30987268518518518
A111: =A110+1 -> 110 | B111: 128 | C111: Larry | D111: Castano | E111: 53 | F111: M | G111: 0.31300925925925926
A112: =A111+1 -> 111 | B112: 48 | C112: Barbara | D112: Elia | E112: 62 | F112: F | G112: 0.31342592592592594
A113: =A112+1 -> 112 | B113: 45 | C113: Juliane | D113: Scheberies | E113: 73 | F113: F | G113: 0.31475694444444446
A114: =A113+1 -> 113 | B114: 65 | C114: Pat | D114: Wellington | E114: 59 | F114: F | G114: 0.32056712962962963
A115: =A114+1 -> 114 | B115: 57 | C115: Wini | D115: Jebian | E115: 63 | F115: F | G115: 0.32745370370370369
A116: =A115+1 -> 115 | B116: 60 | C116: Steve | D116: Jaber | E116: 56 | F116: M | G116: 0.32924768518518516
A117: =A116+1 -> 116 | B117: 61 | C117: Karen | D117: Jaber | E117: 49 | F117: F | G117: 0.32924768518518516
A118: 117 | B118: 56 | C118: Lee | D118: Jebian | E118: 66 | F118: M | G118: 0.33467592592592593