A1: Individual Results
F2: USATF Pacific | G2: Time | I2: Place | J2: Age | K2: Place by
A3: First Name | B3: Last Name | C3: Age | D3: Sex (f/m) | E3: Club | F3: Association? | G3: Min. | H3: Sec. | I3: by speed | J3: Graded % | K3: Age Graded %
A4: Kelly | B4: Wong | C4: 31 | D4: f | E4: GGRW | F4: yes | G4: 28 | H4: 36 | I4: F1 | J4: 0.69199883449883448 | K4: 13
A5: Leslie | B5: Sokol | C5: 49 | D5: f | E5: SCTC | F5: yes | G5: 28 | H5: 39 | I5: F2 | J5: 0.77196044211751014 | K5: 4
A6: Nicolette | B6: Sorensen | C6: 11 | D6: f | E6: DVTC | F6: yes | G6: 28 | H6: 53 | I6: F3 | J6: 0.77271783035199071 | K6: 3
A7: MJ | B7: Baglin | C7: 60 | D7: f | E7: PRO | F7: yes | G7: 30 | H7: 9 | I7: F4 | J7: 0.81969043670536201 | K7: 2
A8: Ann | B8: Gerhardt | C8: 55 | D8: f | E8: Buffalo Chips | F8: yes | G8: 30 | H8: 51 | I8: F5 | J8: 0.75881685575364666 | K8: 5
A9: Susan | B9: Mears | C9: 52 | D9: f | E9: PRO | F9: yes | G9: 31 | H9: 13 | I9: F6 | J9: 0.72819006940736786 | K9: 10
A10: Louise | B10: Walters | C10: 67 | D10: f | E10: SRW | F10: yes | G10: 31 | H10: 56 | I10: F7 | J10: 0.8452974947807933 | K10: 1
A11: Kelsey | B11: Wolfgram | C11: 14 | D11: f | E11: Umoja TC | F11: yes | G11: 33 | H11: 2 | I11: F8 | J11: 0.6378657921291625 | K11: 14
A12: Andree | B12: Enos | C12: 37 | D12: f | E12: PRO | F12: yes | G12: 35 | H12: 39 | I12: F9 | J12: 0.56533426834969613 | K12: 15
A13: Marilyn | B13: McLoughlin | C13: 61 | D13: f | E13: Unattached | F13: no | G13: 44 | H13: 47 | I13: F10 | J13: 0.55833643468552285 | K13: 16
A14: Tyler | B14: Sorensen | C14: 13 | D14: m | E14: DVTC | F14: yes | G14: 27 | H14: 48 | I14: M1 | J14: 0.72883093525179854 | K14: 9
A15: Mike | B15: Counts | C15: 54 | D15: m | E15: SRW | F15: yes | G15: 28 | H15: 10 | I15: M2 | J15: 0.75334319526627225 | K15: 6
A16: Joseph | B16: Berendt | C16: 51 | D16: m | E16: SRW | F16: yes | G16: 28 | H16: 29 | I16: M3 | J16: 0.72600936220011703 | K16: 11
A17: Ronald | B17: Walters | C17: 68 | D17: m | E17: SRW | F17: yes | G17: 32 | H17: 49 | I17: M4 | J17: 0.74510411376333163 | K17: 7
A18: John | B18: Mullane Sr | C18: 69 | D18: m | E18: SCTC | F18: yes | G18: 35 | H18: 23 | I18: M5 | J18: 0.69933584550164862 | K18: 12
A19: Dick | B19: Petruzzi | C19: 74 | D19: m | E19: PRO | F19: yes | G19: 35 | H19: 47 | I19: M6 | J19: 0.7369026548672567 | K19: 8
A24: Team Results: Team score is average of top 3 age grade percentages.
A26: Team | B26: Score | C26: Rank | D26: Points
A27: SRW | B27: =AVERAGE(J18,J23,J25) -> 0.78124826793679902 | C27: =RANK(B35,$B$35:$B$36) -> 1 | D27: =IF(C35=1,10,10-C35) -> 10
A28: PRO | B28: =AVERAGE(J15,J17,J27) -> 0.76159438699332893 | C28: =RANK(B36,$B$35:$B$36) -> 2 | D28: =IF(C36=1,10,10-C36) -> 8