F1: USATF Pacific | G1: Time | I1: Place | J1: Age | K1: Place by
A2: First Name | B2: Last Name | C2: Age | D2: Sex (f/m) | E2: Club | F2: Association? | G2: Min. | H2: Sec. | I2: by speed | J2: Graded % | K2: Age Graded %
A3: Kelly | B3: Wong | C3: 31 | D3: f | E3: GGRW | F3: yes | G3: 27 | H3: 55.51 | I3: F1 | J3: 0.70872152359580065 | K3: 6
A4: Leslie | B4: Sokol | C4: 49 | D4: f | E4: SCTC | F4: yes | G4: 29 | H4: 29.17 | I4: F2 | J4: 0.75006924150873 | K4: 2
A5: Nicolle | B5: Goldman | C5: 48 | D5: f | E5: SRW | F5: yes | G5: 30 | H5: 29.68 | I5: F3 | J5: 0.71899457828691349 | K5: 5
A6: Louise | B6: Walters | C6: 67 | D6: f | E6: SRW | F6: yes | G6: 31 | H6: 43.7 | I6: F4 | J6: 0.85075904816935433 | K6: 1
A7: Laura | B7: Cribbins | C7: 50 | D7: f | E7: GGRW | F7: yes | G7: 31 | H7: 56.35 | I7: F5 | J7: 0.6986302084692253 | K7: 8
A8: Kelsey | B8: Wolfgram | C8: 14 | D8: f | E8: Umoja TC | F8: yes | G8: 34 | H8: 47.43 | I8: F6 | J8: 0.60564905170472783 | K8: 12
A9: Daniel | B9: Coupal | C9: 41 | D9: m | E9: SCTC | F9: yes | G9: 27 | H9: 58.43 | I9: M1 | J9: 0.68133315062290345 | K9: 10
A10: Alexander | B10: Price | C10: 25 | D10: m | E10: PRO | F10: yes | G10: 28 | H10: 18.95 | I10: M2 | J10: 0.6342682244915977 | K10: 11
A11: Joseph | B11: Berendt | C11: 51 | D11: m | E11: SRW | F11: yes | G11: 28 | H11: 42.88 | I11: M3 | J11: 0.7201604290490341 | K11: 4
A12: Jaydeep | B12: Bhatia | C12: 16 | D12: m | E12: Team Olympians | F12: yes | G12: 31 | H12: 56.17 | I12: M4 | J12: 0.59896564501062011 | K12: 13
A13: Ronald | B13: Walters | C13: 68 | D13: m | E13: SRW | F13: yes | G13: 32 | H13: 43.22 | I13: M5 | J13: 0.74729780666456125 | K13: 3
A14: Joe | B14: Anderson | C14: 67 | D14: m | E14: SCTC | F14: yes | G14: 34 | H14: 38.92 | I14: M6 | J14: 0.69754006888191944 | K14: 9
A15: John | B15: Mullane | C15: 69 | D15: m | E15: SCTC | F15: yes | G15: 35 | H15: 21.07 | I15: M7 | J15: 0.69997218385060367 | K15: 7
A19: Team Results: Team score is average of top 3 age grade percentages.
A21: Team | B21: Score | C21: Rank | D21: Points
A22: SRW | B22: =AVERAGE(J15,J20,J22) -> 0.77273909462764989 | C22: =RANK(B35,$B$35:$B$36) -> 1 | D22: =IF(C35=1,10,10-C35) -> 10
A23: SCTC | B23: =AVERAGE(J13,J23,J24) -> 0.71586049808041763 | C23: =RANK(B36,$B$35:$B$36) -> 2 | D23: =IF(C36=1,10,10-C36) -> 8