G9: Time | I9: Place | J9: Age | K9: Place by
B10: First Name | C10: Last Name | D10: Age | E10: Sex (f/m) | F10: Club | G10: Min. | H10: Sec. | I10: by speed | J10: Graded % | K10: Age Graded %
B12: Kelly | C12: Wong | D12: 31 | E12: f | F12: GGRW | G12: 8 | H12: 16.4 | I12: F1 | J12: 0.72953263497179699 | K12: 17
B13: Leslie | C13: Sokol | D13: 49 | E13: f | F13: SCTC | G13: 8 | H13: 31.0 | I13: F2 | J13: 0.79152641878669283 | K13: 7
B14: Nicolle | C14: Goldman | D14: 48 | E14: f | F14: SRW | G14: 8 | H14: 45.2 | I14: F3 | J14: 0.76372810357958865 | K14: 11
B15: Nicolette | C15: Sorensen | D15: 11 | E15: f | F15: DVTC | G15: 8 | H15: 57.8 | I15: F4 | J15: 0.75937151357381927 | K15: 12
B16: Karen | C16: Stoyanowski | D16: 52 | E16: f | F16: SRW | G16: 9 | H16: 35.8 | I16: F5 | J16: 0.72056269538034046 | K16: 18
B17: Louise | C17: Walters | D17: 67 | E17: f | F17: SRW | G17: 9 | H17: 55.3 | I17: F6 | J17: 0.81133882076264074 | K17: 5
B18: Dorris | C18: Cassels | D18: 67 | E18: f | F18: MRW | G18: 9 | H18: 59.9 | I18: F7 | J18: 0.80511751958659783 | K18: 6
B19: Beth | C19: Price | D19: 55 | E19: f | F19: PRO | G19: 10 | H19: 24.9 | I19: F8 | J19: 0.68159705552888461 | K19: 21
B20: Prodeep | C20: Chand | D20: 34 | E20: m | G20: 7 | H20: 29.2 | I20: M1 | J20: 0.75209260908281383 | K20: 14
B21: Abderrezak | C21: Gharfara | D21: 37 | E21: m | G21: 7 | H21: 36.6 | I21: M2 | J21: 0.7524529128339903 | K21: 13
B22: Tyler | C22: Sorensen | D22: 13 | E22: m | F22: DVTC | G22: 7 | H22: 37.9 | I22: M3 | J22: 0.81889058746451204 | K22: 4
B23: Alexander | C23: Price | D23: 25 | E23: m | F23: PRO | G23: 7 | H23: 53.0 | I23: M4 | J23: 0.70268498942917546 | K23: 20
B24: Daniel | C24: Coupal | D24: 41 | E24: m | F24: SCTC | G24: 7 | H24: 59.1 | I24: M5 | J24: 0.73919849718221653 | K24: 15
B25: Kevin | C25: Killingsworth | D25: 51 | E25: m | F25: MRW | G25: 8 | H25: 6.3 | I25: M6 | J25: 0.79076701624511614 | K25: 8
B26: Ted | C26: Moore | D26: 68 | E26: m | F26: PRO | G26: 8 | H26: 7.6 | I26: M7 | J26: 0.93287530762920423 | K26: 1
B27: Joseph | C27: Berendt | D27: 51 | E27: m | F27: SRW | G27: 8 | H27: 20.8 | I27: M8 | J27: 0.76787140575079871 | K27: 10
B28: James | C28: Beckett | D28: 68 | E28: m | F28: MRW | G28: 8 | H28: 24.7 | I28: M9 | J28: 0.90126808004755299 | K28: 3
B29: Mark | C29: Quilantang | D29: 19 | E29: m | G29: 8 | H29: 49.1 | I29: M10 | J29: 0.64362124362124362 | K29: 22
B30: Jack | C30: Bray | D30: 74 | E30: m | F30: MRW | G30: 8 | H30: 52.5 | I30: M11 | J30: 0.920056338028169 | K30: 2
B31: Jon | C31: Price | D31: 57 | E31: m | F31: PRO | G31: 9 | H31: 27.3 | I31: M12 | J31: 0.71493037193724662 | K31: 19
B32: Ronald | C32: Walters | D32: 69 | E32: m | F32: SRW | G32: 9 | H32: 43.7 | I32: M13 | J32: 0.78845297241733769 | K32: 9
B33: Joe | C33: Anderson | D33: 67 | E33: m | F33: SCTC | G33: 10 | H33: 14.7 | I33: M14 | J33: 0.73157637872132741 | K33: 16
B34: Garland | C34: Murphy | D34: 59 | E34: m | G34: 11 | H34: 12.2 | I34: M15 | J34: 0.61499553704254684 | K34: 23
B35: Timothy | C35: Qualantang | D35: 58 | E35: m | G35: 11 | H35: 28.9 | I35: M16 | J35: 0.59430976919727108 | K35: 24
B38: Team Results: Team score is average of top 3 age grade percentages.
B40: Team | C40: Score | D40: Rank | E40: Points
B41: MRW | C41: =AVERAGE(J18,J28,J30) -> 0.87548064588744001 | D41: =RANK(B41,$B$41:$B$44) -> 1 | E41: =IF(C41=1,10,10-C41) -> 10
B42: SRW | C42: =AVERAGE(J17,J32,J27) -> 0.78922106631025901 | D42: =RANK(B42,$B$41:$B$44) -> 2 | E42: =IF(C42=1,10,10-C42) -> 8
B43: PRO | C43: =AVERAGE(J23,J26,J31) -> 0.7834968896652087 | D43: =RANK(B43,$B$41:$B$44) -> 3 | E43: =IF(C43=1,10,10-C43) -> 7
B44: SCTC | C44: =AVERAGE(J13,J24,J33) -> 0.75410043156341222 | D44: =RANK(B44,$B$41:$B$44) -> 4 | E44: =IF(C44=1,10,10-C44) -> 6
B47: Notes: | C47: All individuals listed finished the race without being disqualified.
C48: There were no disqualifications among the women.
C49: There were two disqualifications among the men; their names are not listed.
B51: Judges: | C51: For the Women's Race: Jon Price (Chief Judge), Trish Caldwell, Helen Storrs, and Sue Blochwitz
C52: For the Men's Race: Helen Storrs (Chief Judge), Trish Caldwell, Beth Price, and Sue Blochwitz