B2: Final Points Scores for 2007
A4: Team: First is Sierra Racewalkers.
B5: DATE | C5: 39137 | D5: 39201 | E5: 39229 | F5: 39236 | G5: 39284 | H5: 39341 | I5: 39383 | J5: Top 5 of 7
B6: Location | C6: Los Gatos | D6: Soquel | E6: San Mateo | F6: Stockton | G6: Reno | H6: Oakland | I6: Seaside
A7: PLACE | B7: Club/Distance | C7: 1 Hour | D7: 5K | E7: 5K | F7: 1 mile | G7: 3K | H7: 20K | I7: 10K | J7: Total
A8: 1 | B8: Sierra Racewalkers | C8: 10 | D8: 10 | E8: 10 | F8: 8 | G8: 7 | H8: 10 | I8: 10 | J8: =C8+D8+E8+H8+I8 -> 50
A9: 2 | B9: Pacific Racewalk Organization | C9: 7 | D9: 8 | F9: 7 | G9: 8 | I9: 8 | J9: =C9+D9+E9+F9+G9+H9+I9 -> 38
A10: 3 | B10: Santa Cruz Track Club | C10: 8 | E10: 8 | F10: 6 | I10: 6 | J10: =C10+D10+E10+F10+G10+H10+I10 -> 28
A11: 4 | B11: Marin Racewalkers | F11: 10 | G11: 10 | J11: =C11+D11+E11+F11+G11+H11+I11 -> 20
A12: 5 | B12: Monterey Pennisula WWW Club | I12: 7 | J12: =C12+D12+E12+F12+G12+H12+I12 -> 7
A13: 6 | B13: Golden Gate Racewalkers | I13: 5 | J13: =C13+D13+E13+F13+G13+H13+I13 -> 5
A15: NOTE: See Race Walking Rules for details. For teams, 1st place = 10 points; 2nd = 8 points; 3rd = 7 points; etc.; 9th place and lower =1.
A17: Age Graded (includes women and men together): First is Louise Walters.
B18: DATE | D18: 39137 | E18: 39201 | F18: 39229 | G18: 39236 | H18: 39284 | I18: 39341 | J18: 39383 | K18: Top 5 of 7
B19: Location | D19: Los Gatos | E19: Soquel | F19: San Mateo | G19: Stockton | H19: Reno | I19: Oakland | J19: Seaside
A20: PLACE | B20: Walker (age during season) | C20: Club | D20: 1 Hour | E20: 5K | F20: 5K | G20: 1 mile | H20: 3K | I20: 20K | J20: 10K | K20: Total
A22: =RANK(K22,$K$22:$K$67) -> 31 | B22: Rosewitha Albrecht, 68 & 69 | C22: GGRW | D22: 2 | K22: =D22+E22+F22+G22+H22+I22+J22 -> 2
A23: =RANK(K23,$K$22:$K$67) -> 16 | B23: Susan Armenta, 33 | C23: Unattached | I23: 9 | K23: =D23+E23+F23+G23+H23+I23+J23 -> 9
A24: =RANK(K24,$K$22:$K$67) -> 6 | B24: M. J. Baglin, 60 | C24: PRO | E24: 9 | H24: 4 | J24: 7 | K24: =D24+E24+F24+G24+H24+I24+J24 -> 20
A25: =RANK(K25,$K$22:$K$67) -> 25 | B25: Doris Cassels, 67 | C25: MRW | G25: 5 | K25: =D25+E25+F25+G25+H25+I25+J25 -> 5
A26: =RANK(K26,$K$22:$K$67) -> 28 | B26: Laura Cribbins, 49 & 50 | C26: GGRW | F26: 3 | K26: =D26+E26+F26+G26+H26+I26+J26 -> 3
A27: =RANK(K27,$K$22:$K$67) -> 21 | B27: Shirley Dockstader, 74 | C27: MRW | H27: 7 | K27: =D27+E27+F27+G27+H27+I27+J27 -> 7
A28: =RANK(K28,$K$22:$K$67) -> 27 | B28: Andree Enos, 37 & 38 | C28: PRO | D28: 1 | E28: 1 | H28: 1 | J28: 1 | K28: =D28+E28+F28+G28+H28+I28+J28 -> 4
A29: =RANK(K29,$K$22:$K$67) -> 37 | B29: Marge Garnero, 66 | C29: MPWWC | J29: 1 | K29: =D29+E29+F29+G29+H29+I29+J29 -> 1
A30: =RANK(K30,$K$22:$K$67) -> 22 | B30: Ann Gerhardt, 55 & 56 | C30: Buffalo Chips | E30: 6 | K30: =D30+E30+F30+G30+H30+I30+J30 -> 6
A31: =RANK(K31,$K$22:$K$67) -> 12 | B31: Nicolle Goldman, 48 | C31: SRW | D31: 6 | F31: 6 | G31: 1 | K31: =D31+E31+F31+G31+H31+I31+J31 -> 13
A32: =RANK(K32,$K$22:$K$67) -> 37 | B32: Rita Hildreth, 75 | C32: SSS | H32: 1 | K32: =D32+E32+F32+G32+H32+I32+J32 -> 1
A33: =RANK(K33,$K$22:$K$67) -> 37 | B33: Julie Johnson, 73 & 74 | C33: SSS | H33: 1 | K33: =D33+E33+F33+G33+H33+I33+J33 -> 1
A34: =RANK(K34,$K$22:$K$67) -> 31 | B34: Susan Mears, 51 & 52 | C34: PRO | E34: 1 | H34: 1 | K34: =D34+E34+F34+G34+H34+I34+J34 -> 2
A35: =RANK(K35,$K$22:$K$67) -> 31 | B35: Betsy Miarecki, 45 | C35: WW | H35: 1 | I35: 1 | K35: =D35+E35+F35+G35+H35+I35+J35 -> 2
A36: =RANK(K36,$K$22:$K$67) -> 37 | B36: Beth Price, 55 | C36: PRO | G36: 1 | K36: =D36+E36+F36+G36+H36+I36+J36 -> 1
A37: =RANK(K37,$K$22:$K$67) -> 19 | B37: Hansi Rigney, 65 & 66 | C37: MPWWC | J37: 8 | K37: =D37+E37+F37+G37+H37+I37+J37 -> 8
A38: =RANK(K38,$K$22:$K$67) -> 2 | B38: Leslie Sokol, 49 & 50 | C38: SCTC | D38: 9 | E38: 7 | F38: 9 | G38: 4 | K38: =D38+E38+F38+G38+H38+I38+J38 -> 29
A39: =RANK(K39,$K$22:$K$67) -> 16 | B39: Nicolette Sorensen, 11 & 12 | C39: DVTC | E39: 8 | G39: 1 | K39: =D39+E39+F39+G39+H39+I39+J39 -> 9
A40: =RANK(K40,$K$22:$K$67) -> 22 | B40: Karen Stoyanowski, 52 | C40: SRW | G40: 1 | H40: 1 | J40: 4 | K40: =D40+E40+F40+G40+H40+I40+J40 -> 6
A41: =RANK(K41,$K$22:$K$67) -> 1 | B41: Louise Walters, 67 | C41: SRW | D41: 10 | E41: 10 | F41: 10 | G41: 6 | H41: 6 | I41: 10 | J41: 10 | K41: =D41+E41+F41+I41+J41 -> 50
A42: =RANK(K42,$K$22:$K$67) -> 28 | B42: Kelsey Wolfgram, 13 & 14 | C42: Umoja TC | D42: 1 | E42: 1 | F42: 1 | K42: =D42+E42+F42+G42+H42+I42+J42 -> 3
A43: 10 | B43: Kelly Wong, 30 & 31 | C43: GGRW | E43: 1 | F43: 5 | G43: 1 | H43: 1 | I43: 5 | J43: 3 | K43: =F43+G43+H43+I43+J43 -> 15
A45: =RANK(K45,$K$22:$K$67) -> 25 | B45: Joe Anderson, 67 & 68 | C45: SCTC | D45: 1 | F45: 2 | G45: 1 | J45: 1 | K45: =D45+E45+F45+G45+H45+I45+J45 -> 5
A46: =RANK(K46,$K$22:$K$67) -> 4 | B46: James Beckett, 68 | C46: MRW | G46: 8 | H46: 5 | J46: 9 | K46: =D46+E46+F46+G46+H46+I46+J46 -> 22
A47: 5 | B47: Joe Berendt, 51 | C47: SRW | D47: 5 | E47: 1 | F47: 7 | G47: 1 | I47: 7 | J47: 2 | K47: =D47+F47+G47+H47+I47+J47 -> 22
A48: =RANK(K48,$K$22:$K$67) -> 31 | B48: Jaydeep Bhatia, 16 | C48: Team Olympians | F48: 1 | J48: 1 | K48: =D48+E48+F48+G48+H48+I48+J48 -> 2
A49: =RANK(K49,$K$22:$K$67) -> 7 | B49: Jack Bray, 74 | C49: MRW | G49: 9 | H49: 10 | K49: =D49+E49+F49+G49+H49+I49+J49 -> 19
A50: =RANK(K50,$K$22:$K$67) -> 13 | B50: Mike Counts, 54 & 55 | C50: SRW | D50: 7 | E50: 5 | K50: =D50+E50+F50+G50+H50+I50+J50 -> 12
A51: =RANK(K51,$K$22:$K$67) -> 19 | B51: Daniel Coupal, 41 & 42 | C51: SCTC | D51: 3 | F51: 1 | G51: 1 | I51: 3 | K51: =D51+E51+F51+G51+H51+I51+J51 -> 8
A52: =RANK(K52,$K$22:$K$67) -> 31 | B52: Abderrezak Gharfara, 38 | C52: MRW | G52: 1 | H52: 1 | K52: =D52+E52+F52+G52+H52+I52+J52 -> 2
A53: =RANK(K53,$K$22:$K$67) -> 16 | B53: Mark Green, 51 | C53: PEG | H53: 9 | K53: =D53+E53+F53+G53+H53+I53+J53 -> 9
A54: =RANK(K54,$K$22:$K$67) -> 37 | B54: Rich Hansen, 81 | C54: GGRW | J54: 1 | K54: =D54+E54+F54+G54+H54+I54+J54 -> 1
A55: =RANK(K55,$K$22:$K$67) -> 28 | B55: Kevin Killingsworth, 51 | C55: MRW | G55: 3 | K55: =D55+E55+F55+G55+H55+I55+J55 -> 3
A56: =RANK(K56,$K$22:$K$67) -> 37 | B56: Stu Kinney, 67 | C56: GGRW | J56: 1 | K56: =D56+E56+F56+G56+H56+I56+J56 -> 1
A57: =RANK(K57,$K$22:$K$67) -> 31 | B57: Ed Lane, 71 | C57: MRW | H57: 2 | K57: =D57+E57+F57+G57+H57+I57+J57 -> 2
A58: =RANK(K58,$K$22:$K$67) -> 8 | B58: Ted Moore, 68 | C58: PRO | G58: 10 | H58: 8 | K58: =D58+E58+F58+G58+H58+I58+J58 -> 18
A59: =RANK(K59,$K$22:$K$67) -> 11 | B59: John Mullane, Sr., 69 | C59: SCTC | D59: 4 | E59: 1 | F59: 4 | I59: 4 | J59: 1 | K59: =D59+E59+F59+G59+H59+I59+J59 -> 14
A60: =RANK(K60,$K$22:$K$67) -> 9 | B60: Bill Penner, 60 & 61 | C60: PRO | H60: 3 | I60: 6 | J60: 6 | K60: =D60+E60+F60+G60+H60+I60+J60 -> 15
A61: =RANK(K61,$K$22:$K$67) -> 14 | B61: Dick Petruzzi, 74 | C61: PRO | D61: 8 | E61: 3 | K61: =D61+E61+F61+G61+H61+I61+J61 -> 11
A62: =RANK(K62,$K$22:$K$67) -> 37 | B62: Michael Polish, 65 | C62: Unattached | H62: 1 | K62: =D62+E62+F62+G62+H62+I62+J62 -> 1
A63: =RANK(K63,$K$22:$K$67) -> 22 | B63: Alex Price, 25 | C63: PRO | D63: 1 | F63: 1 | G63: 1 | H63: 1 | I63: 2 | J63: 1 | K63: =F63+G63+H63+I63+J63 -> 6
A64: =RANK(K64,$K$22:$K$67) -> 37 | B64: Jon Price, 57 | C64: PRO | G64: 1 | K64: =D64+E64+F64+G64+H64+I64+J64 -> 1
A65: =RANK(K65,$K$22:$K$67) -> 15 | B65: Tyler Sorensen, 13 | C65: DVTC | D65: 1 | E65: 2 | G65: 7 | K65: =D65+E65+F65+G65+H65+I65+J65 -> 10
A66: =RANK(K66,$K$22:$K$67) -> 37 | B66: Quang Than, 52 | C66: MPWWWC | J66: 1 | K66: =D66+E66+F66+G66+H66+I66+J66 -> 1
A67: =RANK(K67,$K$22:$K$67) -> 3 | B67: Ronald Walters, 68 & 69 | C67: SRW | E67: 4 | F67: 8 | G67: 2 | H67: 1 | I67: 8 | J67: 5 | K67: =D67+E67+F67+G67+I67+J67 -> 27
A70: NOTES: See Race Walking Rules for details. For individuals, 1st place = 10 points; 2nd = 9 pts; 3rd = 8 pts; etc.; 10th place and lower =1.
A71: Jack Bray and Joe Berendt tied for 4th - Jack beat Joe by winning 2 of 2 head-to-head match-ups
A72: Kelly Wong and Bill Penner tied for 9th - Bill beat Kelly by winning 3 of 3 head-to-head match-ups. Ties past 10th place have not been split.
A74: Men's Overall (on the basis of speed): First is Alex Price.
B75: DATE | D75: 39137 | E75: 39201 | F75: 39229 | G75: 39236 | H75: 39284 | I75: 39341 | J75: 39383 | K75: Top 5 of 7
B76: Location | D76: Los Gatos | E76: Soquel | F76: San Mateo | G76: Stockton | H76: Reno | I76: Oakland | J76: Seaside
A77: PLACE | B77: Walker | C77: Club | D77: 1 Hour | E77: 5K | F77: 5K | G77: 1 mile | H77: 3K | I77: 20K | J77: 10K | K77: Total
A79: =RANK(K79,$K$79:$K$102) -> 12 | B79: Joe Anderson, 67 & 68 | C79: SCTC | D79: 3 | F79: 5 | G79: 1 | J79: 3 | K79: =D79+E79+F79+G79+H79+I79+J79 -> 12
A80: =RANK(K80,$K$79:$K$102) -> 10 | B80: James Beckett, 68 | C80: MRW | G80: 3 | H80: 5 | J80: 7 | K80: =D80+E80+F80+G80+H80+I80+J80 -> 15
A81: 2 | B81: Joe Berendt, 51 | C81: SRW | D81: 8 | E81: 8 | F81: 8 | G81: 4 | I81: 9 | J81: 9 | K81: =D81+E81+F81+I81+J81 -> 42
A82: =RANK(K82,$K$79:$K$102) -> 11 | B82: Jaydeep Bhatia, 16 | C82: Team Olympians | F82: 7 | J82: 6 | K82: =D82+E82+F82+G82+H82+I82+J82 -> 13
A83: =RANK(K83,$K$79:$K$102) -> 16 | B83: Jack Bray, 74 | C83: MRW | G83: 2 | H83: 4 | K83: =D83+E83+F83+G83+H83+I83+J83 -> 6
A84: =RANK(K84,$K$79:$K$102) -> 9 | B84: Mike Counts, 54 & 55 | C84: SRW | D84: 9 | E84: 9 | K84: =D84+E84+F84+G84+H84+I84+J84 -> 18
A85: =RANK(K85,$K$79:$K$102) -> 3 | B85: Daniel Coupal, 41 & 42 | C85: Unattached | D85: 10 | F85: 10 | G85: 7 | I85: 10 | K85: =D85+E85+F85+G85+H85+I85+J85 -> 37
B86: Dave Crabbe, 62 | C86: Unattached | K86: =D86+E86+F86+G86+H86+I86+J86 -> 0
A87: =RANK(K87,$K$79:$K$102) -> 8 | B87: Abderrezak Gharfara, 38 | C87: MRW | G87: 10 | H87: 9 | K87: =D87+E87+F87+G87+H87+I87+J87 -> 19
A88: =RANK(K88,$K$79:$K$102) -> 14 | B88: Mark Green, 51 | C88: PEG | H88: 10 | K88: =D88+E88+F88+G88+H88+I88+J88 -> 10
A89: =RANK(K89,$K$79:$K$102) -> 20 | B89: Rich Hansen, 81 | C89: GGRW | J89: 1 | K89: =D89+E89+F89+G89+H89+I89+J89 -> 1
A90: =RANK(K90,$K$79:$K$102) -> 16 | B90: Kevin Killingsworth, 51 | C90: MRW | G90: 6 | K90: =D90+E90+F90+G90+H90+I90+J90 -> 6
A91: =RANK(K91,$K$79:$K$102) -> 20 | B91: Stu Kinney, 67 | C91: GGRW | J91: 1 | K91: =D91+E91+F91+G91+H91+I91+J91 -> 1
A92: =RANK(K92,$K$79:$K$102) -> 19 | B92: Ed Lane, 71 | C92: MRW | H92: 2 | K92: =D92+E92+F92+G92+H92+I92+J92 -> 2
A93: =RANK(K93,$K$79:$K$102) -> 13 | B93: Ted Moore, 68 | C93: PRO | G93: 5 | H93: 6 | K93: =D93+E93+F93+G93+H93+I93+J93 -> 11
A94: =RANK(K94,$K$79:$K$102) -> 7 | B94: John Mullane, Sr., 69 | C94: SCTC | D94: 5 | E94: 6 | F94: 4 | I94: 5 | J94: 2 | K94: =D94+E94+F94+G94+H94+I94+J94 -> 22
A95: =RANK(K95,$K$79:$K$102) -> 6 | B95: Bill Penner, 60 & 61 | C95: PRO | H95: 7 | I95: 8 | J95: 8 | K95: =D95+E95+F95+G95+H95+I95+J95 -> 23
A96: =RANK(K96,$K$79:$K$102) -> 15 | B96: Dick Petruzzi, 74 | C96: PRO | D96: 4 | E96: 5 | K96: =D96+E96+F96+G96+H96+I96+J96 -> 9
A97: =RANK(K97,$K$79:$K$102) -> 20 | B97: Michael Polish, 65 | C97: Unattached | H97: 1 | K97: =D97+E97+F97+G97+H97+I97+J97 -> 1
A98: =RANK(K98,$K$79:$K$102) -> 1 | B98: Alex Price, 25 | C98: PRO | D98: 7 | F98: 9 | G98: 8 | H98: 8 | I98: 7 | J98: 10 | K98: =F98+G98+H98+I98+J98 -> 42
A99: =RANK(K99,$K$79:$K$102) -> 20 | B99: Jon Price, 57 | C99: PRO | G99: 1 | K99: =D99+E99+F99+G99+H99+I99+J99 -> 1
A100: =RANK(K100,$K$79:$K$102) -> 5 | B100: Tyler Sorensen, 13 | C100: DVTC | D100: 6 | E100: 10 | G100: 9 | K100: =D100+E100+F100+G100+H100+I100+J100 -> 25
A101: =RANK(K101,$K$79:$K$102) -> 18 | B101: Quang Than, 52 | C101: MPWWWC | J101: 4 | K101: =D101+E101+F101+G101+H101+I101+J101 -> 4
A102: =RANK(K102,$K$79:$K$102) -> 4 | B102: Ronald Walters, 68 & 69 | C102: SRW | E102: 7 | F102: 6 | G102: 1 | H102: 3 | I102: 6 | J102: 5 | K102: =D102+E102+F102+H102+I102+J102 -> 27
A105: NOTES: See Race Walking Rules for details. For individuals, 1st place = 10 points; 2nd = 9 pts; 3rd = 8 pts; etc.; 10th place and lower =1.
A106: Alex Price and Joe Berendt tied for first in points - Alex won because he beat Joe 3 of 5 head-to-head races.
A108: Women's Overall (on the basis of speed): First is Kelly Wong.
B109: DATE | D109: 39137 | E109: 39201 | F109: 39229 | G109: 39236 | H109: 39284 | I109: 39341 | J109: 39383 | K109: Top 5 of 7
B110: Location | D110: Los Gatos | E110: Soquel | F110: San Mateo | G110: Stockton | H110: Reno | I110: Oakland | J110: Seaside
A111: PLACE | B111: Walker | C111: Club | D111: 1 Hour | E111: 5K | F111: 5K | G111: 1 mile | H111: 3K | I111: 20K | J111: 10K | K111: Total
A113: =RANK(K113,$K$113:$K$134) -> 15 | B113: Rosewitha Albrecht, 68 & 69 | C113: GGRW | D113: 5 | K113: =D113+E113+F113+G113+H113+I113+J113 -> 5
A114: =RANK(K114,$K$113:$K$134) -> 12 | B114: Sus+B28an Armenta, 33 | C114: WP Int'l | I114: 10 | K114: =D114+E114+F114+G114+H114+I114+J114 -> 10
A115: =RANK(K115,$K$113:$K$134) -> 5 | B115: M. J. Baglin, 60 | C115: PRO | E115: 7 | H115: 9 | J115: 6 | K115: =D115+E115+F115+G115+H115+I115+J115 -> 22
A116: =RANK(K116,$K$113:$K$134) -> 17 | B116: Doris Cassels, 67 | C116: MRW | G116: 4 | K116: =D116+E116+F116+G116+H116+I116+J116 -> 4
A117: =RANK(K117,$K$113:$K$134) -> 13 | B117: Laura Cribbins, 49 & 50 | C117: GGRW | F117: 6 | K117: =D117+E117+F117+G117+H117+I117+J117 -> 6
A118: =RANK(K118,$K$113:$K$134) -> 15 | B118: Shirley Dockstader, 74 | C118: MRW | H118: 5 | K118: =D118+E118+F118+G118+H118+I118+J118 -> 5
A119: =RANK(K119,$K$113:$K$134) -> 10 | B119: Andree Enos, 37 & 38 | C119: PRO | D119: 6 | E119: 2 | H119: 3 | J119: 3 | K119: =D119+E119+F119+G119+H119+I119+J119 -> 14
A120: =RANK(K120,$K$113:$K$134) -> 20 | B120: Marge Garnero, 66 | C120: MPWWC | J120: 2 | K120: =D120+E120+F120+G120+H120+I120+J120 -> 2
A121: =RANK(K121,$K$113:$K$134) -> 13 | B121: Ann Gerhardt, 55 & 56 | C121: Buffalo Chips | E121: 6 | K121: =D121+E121+F121+G121+H121+I121+J121 -> 6
A122: =RANK(K122,$K$113:$K$134) -> 4 | B122: Nicolle Goldman, 48 | C122: SRW | D122: 9 | F122: 8 | G122: 8 | K122: =D122+E122+F122+G122+H122+I122+J122 -> 25
A123: =RANK(K123,$K$113:$K$134) -> 22 | B123: Rita Hildreth, 75 | C123: SSS | H123: 1 | K123: =D123+E123+F123+G123+H123+I123+J123 -> 1
A124: =RANK(K124,$K$113:$K$134) -> 20 | B124: Julie Johnson, 73 & 74 | C124: SSS | H124: 2 | K124: =D124+E124+F124+G124+H124+I124+J124 -> 2
A125: =RANK(K125,$K$113:$K$134) -> 7 | B125: Susan Mears, 51 & 52 | C125: PRO | E125: 5 | H125: 8 | J125: 5 | K125: =D125+E125+F125+G125+H125+I125+J125 -> 18
A126: =RANK(K126,$K$113:$K$134) -> 11 | B126: Betsy Miarecki, 45 | C126: WW | H126: 4 | I126: 7 | K126: =D126+E126+F126+G126+H126+I126+J126 -> 11
A127: =RANK(K127,$K$113:$K$134) -> 19 | B127: Beth Price, 55 | C127: PRO | G127: 3 | K127: =D127+E127+F127+G127+H127+I127+J127 -> 3
A128: =RANK(K128,$K$113:$K$134) -> 17 | B128: Hansi Rigney, 65 & 66 | C128: MPWWC | J128: 4 | K128: =D128+E128+F128+G128+H128+I128+J128 -> 4
A129: =RANK(K129,$K$113:$K$134) -> 2 | B129: Leslie Sokol, 49 & 50 | C129: SCTC | D129: 10 | E129: 9 | F129: 9 | G129: 9 | J129: 7 | K129: =D129+E129+F129+G129+H129+I129+J129 -> 44
A130: =RANK(K130,$K$113:$K$134) -> 8 | B130: Nicolette Sorensen, 11 & 12 | C130: DVTC | E130: 8 | G130: 7 | K130: =D130+E130+F130+G130+H130+I130+J130 -> 15
A131: =RANK(K131,$K$113:$K$134) -> 6 | B131: Karen Stoyanowski, 52 | C131: SRW | G131: 6 | H131: 6 | J131: 9 | K131: =D131+E131+F131+G131+H131+I131+J131 -> 21
A132: =RANK(K132,$K$113:$K$134) -> 3 | B132: Louise Walters, 67 | C132: SRW | D132: 8 | E132: 4 | F132: 7 | G132: 5 | H132: 7 | I132: 8 | J132: 8 | K132: =D132+F132+H132+I132+J132 -> 38
A133: 9 | B133: Kelsey Wolfgram, 13 & 14 | C133: Umoja TC | D133: 7 | E133: 3 | F133: 5 | K133: =D133+E133+F133+G133+H133+I133+J133 -> 15
A134: =RANK(K134,$K$113:$K$134) -> 1 | B134: Kelly Wong, 30 & 31 | C134: GGRW | E134: 10 | F134: 10 | G134: 10 | H134: 10 | I134: 9 | J134: 10 | K134: =D134+E134+F134+G134+H134+J134 -> 50
A137: NOTES: See Race Walking Rules for details. For individuals, 1st place = 10 points; 2nd = 9 pts; 3rd = 8 pts; etc.; 10th place and lower =1.
A138: Kelsey Wolfgram and Nicolette Sorensen tied for 8th. Nicollette beat Kelsey in their only head-to-head meeting, so she gets 8th.
A139: Ties past 10th place have not been split.